{
  "schema_version": 3,
  "content_version": "2026-09-12.1",
  "identity": {
    "name": "Andris Rožkalns",
    "role": "Junior Technical Support / Linux Operations",
    "location": "Dortmund, Germany",
    "availability": "2027-01",
    "career_goal": "Junior Technical Support, Linux Operations, or Application Support, with later growth toward cloud automation and DevOps"
  },
  "contact": {
    "email": {
      "value": "andris@rozkalns.net",
      "visibility": "public"
    },
    "phone": {
      "visibility": "runtime-protected"
    },
    "github": {
      "value": "https://github.com/rozkalnsandris",
      "visibility": "public"
    },
    "website": {
      "value": "https://rozkalns.net/",
      "visibility": "public"
    }
  },
  "languages": [
    {
      "name": "Latvian",
      "level": "native"
    },
    {
      "name": "English",
      "level": "fluent working language"
    },
    {
      "name": "German",
      "level": "B1"
    }
  ],
  "experience": [
    {
      "id": "sonepar",
      "role": "Warehouse Employee",
      "organization": "Sonepar Deutschland GmbH, Region West",
      "location": "Dortmund, Germany",
      "start": "2024-01",
      "end": "2026-12",
      "end_planned": true,
      "highlights": [
        "Processed high-volume electrical wholesale orders using scanner systems",
        "Prepared cable, operated forklifts, and worked rotating logistics shifts",
        "Maintained reliable, process-focused work across rotating logistics shifts"
      ]
    },
    {
      "id": "kbs",
      "role": "Warehouse Employee",
      "organization": "KBS",
      "location": "Dortmund, Germany",
      "start": "2023-07",
      "end": "2023-12",
      "highlights": [
        "Worked at the same Dortmund warehouse before the employer and contract changed to Sonepar in January 2024",
        "Handled the same practical warehouse and logistics work during the employer transition"
      ]
    },
    {
      "id": "koksne",
      "role": "Paint Shop Supervisor / Lead Sprayer",
      "organization": "SIA Koksne",
      "location": "Latvia",
      "start": "2020-05",
      "end": "2023-06",
      "highlights": [
        "Managed daily production, warehouse workflow, and staff tasks",
        "Performed precision airless coating of wooden windows and doors"
      ]
    },
    {
      "id": "apavu-bode",
      "role": "Warehouse / Shop Manager",
      "organization": "SIA Apavu Bode",
      "location": "Latvia",
      "start": "2011-08",
      "end": "2020-04",
      "highlights": [
        "Managed receiving, stock organisation, staff coordination, and daily operations"
      ]
    },
    {
      "id": "early-it",
      "role": "Early IT — self-taught",
      "organization": "Secondary school",
      "location": "Riga, Latvia",
      "start": "2008",
      "end": "2011",
      "highlights": [
        "Administered Linux Counter-Strike 1.6 servers through SSH and FTP",
        "Maintained IPB forum templates and plugins and built HTML websites"
      ]
    }
  ],
  "education": [
    {
      "id": "linux-operations-lab-learning",
      "title": "Linux Operations Lab",
      "start": "2026",
      "status": "structured study plan starting 14 Sep 2026",
      "detail": "Public seven-week support and Linux operations learning plan with evidence added as work is completed"
    },
    {
      "id": "rsu",
      "title": "Multimedia Communication",
      "organization": "Rīga Stradiņš University",
      "start": "2011",
      "end": "2013",
      "status": "partial studies, not completed"
    },
    {
      "id": "secondary",
      "title": "Secondary Education",
      "organization": "Riga 45th Secondary School",
      "start": "2004",
      "end": "2011"
    }
  ],
  "skills": {
    "core": [
      "Linux administration",
      "Docker",
      "Docker Compose",
      "Bash",
      "Nginx",
      "DNS",
      "SSL/TLS",
      "Prometheus",
      "Grafana",
      "systemd",
      "Git"
    ],
    "working": [
      "Python",
      "REST APIs",
      "YAML"
    ],
    "learning": [
      "Basic SQL"
    ],
    "foundations": [
      "Networking",
      "SSH/FTP",
      "HTML/CSS"
    ]
  },
  "projects": [
    {
      "id": "linux-ops-lab",
      "title": "Linux Operations Lab",
      "facts": [
        "Structured seven-week public learning portfolio running from 14 Sep to 31 Oct 2026",
        "Uses a symptom, evidence, hypothesis, test, root-cause, fix-or-escalate, verify, document operating model",
        "Completed incidents, runbooks and scripts are published only when they exist"
      ]
    },
    {
      "id": "cv-platform",
      "title": "rozkalns.net CV platform",
      "facts": [
        "Recruiter-facing multilingual CV and portfolio on a self-hosted Linux stack",
        "Deterministic frontend and PDF generation with browser and security checks",
        "Privacy-bounded CV assistant and public evidence links"
      ]
    },
    {
      "id": "homelab",
      "title": "Self-hosted Linux server environment",
      "facts": [
        "Raspberry Pi 5 with NVMe storage",
        "Docker Compose services running 24/7",
        "Nginx, AdGuard Home, TLS, and Cloudflare Tunnel"
      ]
    },
    {
      "id": "observability",
      "title": "Monitoring and observability",
      "facts": [
        "Prometheus",
        "Grafana",
        "Node Exporter",
        "live CV metrics"
      ]
    },
    {
      "id": "maintenance",
      "title": "Automated maintenance",
      "facts": [
        "controlled APT and container updates",
        "Telegram evidence",
        "availability checks"
      ]
    },
    {
      "id": "hermes",
      "title": "Hermes self-hosted AI agent",
      "facts": [
        "Primary and fallback LLM routing",
        "ChromaDB vector search and persistent memory",
        "Telegram and Home Assistant integration"
      ]
    },
    {
      "id": "home-automation",
      "title": "Home automation",
      "facts": [
        "Matter devices",
        "Home Assistant dashboards",
        "energy-cost tracking"
      ]
    },
    {
      "id": "irrigation",
      "title": "Balcony irrigation",
      "facts": [
        "ESP32",
        "15 moisture sensors",
        "relay pump",
        "multiplexer",
        "safety limits"
      ]
    }
  ],
  "infrastructure": {
    "host": "Raspberry Pi 5",
    "storage": "NVMe SSD",
    "runtime": "Docker Compose",
    "availability": "24/7",
    "public_site": "https://rozkalns.net/"
  },
  "skill_groups": {
    "linux_operations": [
      "Linux administration",
      "systemd",
      "SSH/FTP"
    ],
    "networking_web": [
      "Networking",
      "DNS",
      "SSL/TLS",
      "Nginx"
    ],
    "containers_monitoring": [
      "Docker",
      "Docker Compose",
      "Prometheus",
      "Grafana"
    ],
    "application_support": [
      "REST APIs",
      "Basic SQL",
      "HTML/CSS"
    ],
    "automation_git": [
      "Bash",
      "Python",
      "YAML",
      "Git"
    ]
  }
}
